Categories,ProductName,Price,Ingredients,NutritionalFacts,Illness
icecream,MagnumAlmodMadeWithBelgianChocolate -64g,45,"Belgian Chocolate&Chocolate Confectionery (32%) [ Sugar, Cocoa Butter, Whole Milk Powder, Cocoa Mass, Milk Fat, Non-Hydrogenated Coconut Oil, Emulsifier (Soy Lecithin), Flavourings], Sugar, Non-Hydrogenated Coconut Oil, Milk Solids (Skimmed Milk Powder, Whey Protein Concentrate), Almond Pieces (5.3%), Glucose Syrup, Emulsifiers ( Mono& Diglycerides Of Fatty Acids - Plant Origin), Stabilisers (Locust Bean Gum, Guar Gum, Carrageen), Natural Vanilla Flavouring, Natural Coloring ( Beta Carotene), Contains: Soy, Lecithin, Milk And Almond, Wheat, Peanuts, Other Tree Nuts, Barley And Eggs","Calories(240), TotalFat(16g), SatFat(10g), TransFat(0g), Cholesterol(0.005g), Sodium(0.025g), TCarbs( 21g), DietFbr(0g),  Tsugar(18g), Protein(3g), VitA(0%),  VitC(0%),Calcium(10%), Iron(0%)","Hypertension, Diabetes"
icecream,MagnumClassicMadeWithBelgianChocolate 64-g,45,"White Chocolate*, Chocolate Cookie, Sugar, Coconut Oil, Milk Solids (Skimmed Milk Powder, Whey Protein Concentrate), Glucose Syrup, Maltodextrin, Salt, Contains Permitted Emulsifiers (INS 471 - plant origin), Stabilisers (INS 410, INS 412, INS 407) and Flavourings Substances of Plant and Synthetic Origin. *Cocoa sourced from Rainforest Alliance Certified farms, Contains:Contains milk and wheat. May contain soy lecithin, peanuts, tree nuts, barley and eggs","Calories(210), TotalFat(13g), SatFat(9g), TransFat(0g), Cholesterol(0.005g), Sodium(0.020g), TCarbs( 21g), DietFbr(0g),  Tsugar(17g), Protein(2g), VitA(0%),  VitC(0%),Calcium(10%), Iron(0%)","Hypertension, Diabetes"
icecream,NestlePadddlePopTornadoGrape 50-g,50,"Gape Flavoured Carrageenan Dessert [ Sugar, Glucose Syrup, Stabilisers (Carrageenan (0.35), Locust Bean Gum), Acidity Regulators (Trisodium Citrate, Citric Acid), Flavouring, Salt, Colourings (Carmoisine, Brilliant Blue FCF)], Sugar, Glucose Syrup, Flavouring, Stabilisers (Locust Bean Gum, Guar Gum), Acidity Regulator (Citric Acid), Colouring (Carmoisine), Contains: MIlk, Wheat, Barley","Calories(50), TotalFat(0g), SatFat(0g), TransFat(0g), Cholesterol(0g), Sodium(0.040g), TCarbs( 13g), DietFbr(0g),  Tsugar(11g), Protein(0g), VitA(0%),  VitC(0%),Calcium(10%), Iron(0%)","Diabetes, Skin Diseases"
icecream,SelectaRockyRoadChocolateFlavoredIceCreamStick 50-ml,50,"Water, Glucose, Refined Sugar, Palm Oil, Marshmallows, Peanuts, Chocolate Chips, Skimmed Milk Powder, Buttermilk Powder, Cocoa Powder, Whey Powder, Modified Starch, Food Stabilizers And Emulsifiers, Ice Structuring Protein, Artificial Food Flavors And Artificial Food Colors Including FD&C Yellow #5 (Tartrazine).","Calories(78), TotalFat(3g), SatFat(1g), TransFat(0g), Cholesterol(0g), Sodium(0.018g), TCarbs( 13g), DietFbr(1g),  Tsugar(8g), Protein(1g), VitA(0%),  VitC(0%),Calcium(10%), Iron(0%)","Hypertension, Diabetes"
icecream,SlectaCocoMelon 110-ml,100,"Water, Refined Sugar, Buco Bits, Modified Starch, Non- Hydrogenated Palm Oil, Glucose, Whey Powder, SkimmedMilk Powder ButterMilk Powder, Food Stabilizers ( Locust Bean Gum, Guar Gum, Carrageenan, And Carboxymethyl cellulose) And Emulsifiers  ( Mono And Diglycerides), Coconut Milk Powder, Artificial Food Flavors, And Artificial Food Color ( FD&C Yellow#6), Contains: MIlk, Coconut, Peanuts, Tree Nuts, Eggs, Wheat, Soya, And Tartrazine","Calories(59), TotalFat(2g), SatFat(1g), TransFat(0g), Cholesterol(0.001g), Sodium(0.019g), TCarbs( 10g), DietFbr(1g),  Tsugar(7g), Protein(1g), VitA(0%),  VitC(0%),Calcium(10%), Iron(0%)","Diabetes, Kidney Diseases"
icecream,SelectaQuezoReal 50-ml,56,"Water, Whole Milk Powder, Coconut Milk, Processed Cheese, Refined Sugar, Palm Oil, Skimmed Milk Powder, Buttermilk Powder, Whey Powder, Modified Starch, Food Stabilizers And Emulsifiers, Artificial Food Flavors And Artificial Food Colors Including FD&C Yellow #5 (Tartrazine).","Calories(73), TotalFat(3g), SatFat(1g), TransFat(0g), Cholesterol(0.002g), Sodium(0.087g), TCarbs( 10g), DietFbr(1g),  Tsugar(7g), Protein(1g), VitA(0%),  VitC(0%),Calcium(10%), Iron(0%)","Hypertension, Diabetes"
icecream,SelectaCocoUbe 50-ml,56,"Water, Refined Suugar, Buco Bits, Modified Starch, Non Hydrogenated Palm Oil, Glucose, Whey Powder, Skimmed Milk Powder, ButterMilk Powder, Food Stabilizers ( Locust Bean Gum, Guar Gum, Carrageenan, And Carboxymethyl Cellulose) And Emulsifiers ( Distilled Mono And Digycerides), Coconut Milk Powder, Artificial Food Flavors, And Artificial Food Colors (FD&C Red#2 And FD&C Blue #1), Contains: Milk, Coconut, Peanuts, Tree Nuts, Eggs. Wheat, Soya And FD&C Yellow (Tartrazine)","Calories(64), TotalFat(2g), SatFat(1g), TransFat(0g), Cholesterol(0.001g), Sodium(0.021g), TCarbs( 11g), DietFbr(0g),  Tsugar(7g), Protein(1g), VitA(0%),  VitC(0%),Calcium(10%), Iron(0%)","Diabetes, Kidney Diseases"
icecream,SelectaCookies&CreamBoomBoom 60-ml,66,"Water, Cookies & Cream Coating (Vegetable Oil [Coconut And/Or Palm], Refined Sugar, Whey Powder, Skimmed Milk Powder, Choco Cookie Fines [Wheat Flour, Cocoa Powder And Soya Lecithin] And Artificial Food Flavor), Refined Sugar, Dark Choco Cookies (Wheat Flour, Refined Sugar, Palm Oil, Skimmed Milk Powder, Soya Lecithin And Artificial Food Flavor), Glucose, Palm Oil, Skimmed Milk Powder, Buttermilk Powder, Modified Starch, Whey Powder, Food Stabilizers (Locust Bean Gum, Guar Gum, Carrageenan And Carboxymethyl Cellulose) And Emulsifiers (Distilled Mono And Diglycerides), Artificial Food Colors FD&C Yellow #5 (Tartrazine) And FD&C Yellow #6) And Artificial Food Flavors.","Calories(140), TotalFat(9g), SatFat(7g), TransFat(0g), Cholesterol(0.001g), Sodium(0.055g), TCarbs( 15g), DietFbr(1g),  Tsugar(11g), Protein(1g), VitA(0%),  VitC(0%),Calcium(10%), Iron(0%)","Hypertension, Diabetes"
icecream,SelectaBirthdayEspesyalMangoFloatMangoIceCreamWith GrahamCracker 1.3L,250,"Water, Glucose, Refined Sugar, Mango Puree, Skimmed Milk Powder, Buttermilk Powder, Graham Crackers (Wheat Flour, Whole Wheat Flour, Sugar, Vegetable Shortening, Caramel Color, Leavening [Ammonium Bicarbonate And Sodium Bicarbonate], Malt Extract, Honey, Iodized Salt, Vanilla Flavor, And Sodium Metabisulfite), Non-Hydrogenated Palm Oil, Modified Starch, Whey Powder, Food Stabilizers (Locust Bean Gum, Guar Gum, Carrageenan, And Carboxymethyl Cellulose) And Emulsifiers (Distilled Mono And Diglycerides), Citric Acid, Artificial Food Flavor, And Artificial Food Color FD&C Yellow #6 (Sunset Yellow) Including FD&C Yellow #5 (Tartrazine), Contains: Milk, Wheat, And FD&C, Peanuts, Tree Nuts, Eggs, And Soya","Calories(106), TotalFat(5g), SatFat(2g), TransFat(0g), Cholesterol(0g), Sodium(0.030g), TCarbs( 14g), DietFbr(1g),  Tsugar(11g), Protein(1g), VitA(0%),  VitC(0%),Calcium(10%), Iron(0%)","Hypertension, Diabetes"
icecream,SelectaSuperThickStrawberry 1.3L,350,"Water, StrawBerry Puree, Refined Sugar, Non-Hydrogenated Palm Oil, Glucose, Skimmed Milk Powder, ButterMilk Powder, Whey Powder, Modifiedd Starch, Food, Stabilizers (Locust Bean Gum, Guar Gum, Carrageenan, And Carboxymethyl Cellulose) And Emulsifiers ( Distilled Mono And Diglycerides), Citric Acid, Artificial Food Flavors, And Artificial Food Color FD&C Red#40 (Allura Red), Contains: Milk, Peanuts, Tree Nuts, Wheat, Eggs, Soya","Calories(100), TotalFat(4g), SatFat(2g), TransFat(0g), Cholesterol(0g), Sodium(0.040g), TCarbs( 15g), DietFbr(1g),  Tsugar(11g), Protein(2g), VitA(0%),  VitC(0%),Calcium(10%), Iron(0%)","Hypertension, Diabetes"
icecream,CornettoMiniChocolateVanilla 336-ml,320,"Bicuit Cone [Wheat Flour, Sugar, Corn Starch, Coconut Oil, Emulsifiers (Lecithin, Salt, Flavouring, Colouring ( Brown HT)], Chocolate Compound 18%) [ Sugar, Coconut Oil, Cocoa Powder, Plam Fat, Emulsifiers (Lecithin, Polyglycerol Esters Of Fatty Acids)], Sugar, Milk Solids] Skimmed Milk Powder, Whey Powder, Whey Protein Concentrate), Glucose Syrup, Peanut Pieces (3.4%) Non-Hydrogenated Vegetable Oil (Coconut, Palm), Stabilisers (Guar Gum Locust Bean Gum, Tara GUm, Carrageenan), Emulsifiers (Mono And Diglyceride Of Fatty Acids- Plant Agent), Flavouring, Contains: Wheat, Soy Lecithin, Peanuts And Milk, Tree Nuts And Eggs","Calories(60), TotalFat(2g), SatFat(2g), TransFat(0g), Cholesterol(0g), Sodium(0.020g), TCarbs( 9g), DietFbr(1g),  Tsugar(5g), Protein(1g), VitA(0%),  VitC(0%),Calcium(10%), Iron(0%)","Hypertension, Diabetes"
icecream,SelectaStawberriesN'CremeCreamBaseWith Strawberry Pieces 1.3-L,300,"Water, Strawberry Pieces (Strawberry, Sugar, Glucose, Food Stablizer (Carboxymethyl Cellulose)), Strawberry Puree Non-Hydrogenated Palm Oil, Skimmed Milk Powder, ButterMilk Powder, Glcose Syrup, Refined Sugar, Whey, Powder, Modified Starch Milk Fat, Food Stabilizers (Locust, Bean Gum Guar Gum, Carrageenan, And Carboxymethyl Cellulose) And Emulsifiers (Distilled Mono And Diglycerides) Artificial Food Flavors,, Malic ACid, And Citric Acid, Contains: Milk, PEanuts, Tree Nuts, Soya, Wheat, Egg ","Calories(114), TotalFat(5g), SatFat(3g), TransFat(0g), Cholesterol(0.005g), Sodium(0.034g), TCarbs( 17g), DietFbr(1g),  Tsugar(12g), Protein(2g), VitA(0%),  VitC(0%),Calcium(10%), Iron(0%)","Hypertension, Diabetes"
icecream,AiceChocoMallowBlizz&CreamyMilkCookies 1.3-L,260,"Water, Sugar, Milk, Solids (Whole Milk Powder, Simmed Powder), Coconut Oil, Chocolaate Biscuits Crumbs, Marshallow, Maltose Syrup, Butter, Cocoa Powder, Permitted Stabilizers (Guar GUm INS 412, Sodium CarboxyMethyl Cellulose INS 466, Xanthan Gum INS 415, Caraggeenan INS Color (Caramel II-Ammonia Caramel INS 150c), Artificial Flavor, Contains: Milk Wheat Flavour","Calories(99), TotalFat(3g), SatFat(3g), TransFat(0g), Cholesterol(0.003g), Sodium(0.027g), TCarbs( 16), DietFbr(0g),  Tsugar(11g), Protein(2g), VitA(0%),  VitC(0%),Calcium(10%), Iron(0%)","Hypertension, Diabetes"
icecream,OreoIceCreamChocolateFlavoredSandwichBiscuitsFIlledWithCreamFlavoredIceCreamWIthCrushedOreoChocolateFlavoredBiscuits 110-ml,340,"Oreo Wafer And Cookie Pieces (Unbleached Enriched Flour [Wheat Flour, Niacin, Reduced Iron, Thiamine Mononitrate, Riboflavin, Folic Acid], Sugar, Palm And/Or Canola Oil, Cocoa Processed With Alkali, Invert Sugar, High Fructose Corn Syrup, Baking Soda, Calcium Phosphate, Salt, Soy Lecithin, Chocolate, Natural And Artificial Flavor), Dairy Product Solids, Skim Milk, Sugar, Corn Syrup, Cream, Coconut Oil, Maltodextrin, Propylene Glycol Monostearate, Cellulose Gel, Guar Gum, Monoglycerides, Carob Bean Gum, Cellulose Gum, Natural Flavor. Contains: Wheat, Milk, And Soy Ingredients.","Calories(210), TotalFat(6g), SatFat(2g), TransFat(0g), Cholesterol(0.005g), Sodium(0.200g), TCarbs( 35g), DietFbr(1g),  Tsugar(17g), Protein(2g), VitA(0%),  VitC(0%),Calcium(10%), Iron(0.0019g)","Hypertension, Diabetes"
icecream,NobrelliChoco-Mangga-ubeFlavoredIceCream 1.3-L,336,"Water, Glucose Syrup, Sugar, Milk Powders (Contains, Buttered Milk, Whey Or Whole Milk Powder), Vegetable Oil, Mango Pure, Ube  Puree, Cocoa Powder, Stabilizers (Modified Starch Guar Gum), Emulsifiers ( Proplene Glycol Esters Of Fatty Acid, Mono- And Disglycerides), Nature- Identical, Artificial, And Natural Flavors, Artifical Food Colors, Food Acids (Citric Acid, Malic Acid), Contains: Milk","Calories(95), TotalFat(3g), SatFat(1.5g), TransFat(0g), Cholesterol(0.001g), Sodium(0.020g), TCarbs( 16g), DietFbr(0g),  Tsugar(11g), Protein(1g), VitA(0%),  VitC(0%),Calcium(10%), Iron(0.0019g)","Hypertension, Diabetes"
FrozenGoods,TenderJuicyHotdogClassic 1-kg,140,"Beef And Magnolia Chicken and Mechanically Separated Poultry, Water, Soy Protein, Sugar, Modified Starch, Lodized Salt, Milk Powder, Flavors, Sodium Phosphates (Acidity Regulator), Spices, Iodized Salt, Mlik Powder, Flavors, Erythorbate (Reducing Agent), Sodium Nitrite(color Retention Agent), And Artificial Food Color From Casing (Allura Red) , Contains: Soy, Mlik, Mustard, Wheat (Gluten), And Sulphites","Calories(67), TotalFat(5g), SatFat(2g), TransFat(0g), Cholesterol(0.018g), Sodium(0.183g), TCarbs(2g), DietFbr(1g),  Tsugar(1g), Protein(4g), VitA(0%),  VitC(0%),Calcium(0%), Iron(0%)","Diabetes, Hypertension"
FrozenGoods,PureFoodsTJFrozenChicken&CheeseHotdog 1-kg,150,"Magnolia Chicken Meat And Mechanically Separated PoultryMeat, Water, Soy Protein, Sugar, Modified Starch, Iodized Salt, Milk Powder, Starch, Spices, Sodium Phosphates (Acidity Regulator), Flavors, Carrageenan (Stabilizer), Xanthan Gum (Stabilizer, Emulsifier), Sodium Erythorbate (Reducing Agent), Sodium Nitrate (Color Retention Agent), And Artificial Food Color From Casing (Sunset Yellow), Contains: Soy, Milk, Mustard Wheat (Gluten), And Sulphite","Calories(49), TotalFat(3g), SatFat(1g), TransFat(0g), Cholesterol(0.016g), Sodium(0.24g), TCarbs(2g), DietFbr(1g),  Tsugar(1g), Protein(4g), VitA(0%),  VitC(0%),Calcium(0%), Iron(0%)","Diabetes, Hypertension"
FrozenGoods,TenderJuicyHotdogCockTail 1-kg,180,"Beef And Magnolia Chicken and Mechanically Separated Poultry, Water, Soy Protein, Sugar, Modified Starch, Lodized Salt, Milk Powder, Flavors, Sodium Phosphates (Acidity Regulator), Spices, Iodized Salt, Mlik Powder, Flavors, Erythorbate (Reducing Agent), Sodium Nitrite(color Retention Agent), And Artificial Food Color From Casing (Allura Red) , Contains: Soy, Mlik, Mustard, Wheat (Gluten), And Sulphites","Calories(67), TotalFat(5g), SatFat(2g), TransFat(0g), Cholesterol(0.019g), Sodium(0.227g), TCarbs(2g), DietFbr(1g),  Tsugar(1g), Protein(4g), VitA(0%),  VitC(0%),Calcium(0%), Iron(0%)","Diabetes, Hypertension"
FrozenGoods,PureFoodsSweetChiliTocino 220-g,130,"Pork, Sugar, Water, Pineapple Juice, Iodized Sal, Modified Starch, Flavors, Pepper Flakes, Sodium Phosphate (Acidity Regulator),  Monosodium Glutamate (Flavor Enhancer), Carrageenan (Stabilizer), Spices, Sodium Erythorbate (Reducing Agent), Sodium Nitrite (Color Retention Agent), Tertiary Butylhydroquinone (Antioxidant), And Allura Red (Artificiial Food Color), Contains: soy and sulphites","Calories(93), TotalFat(2g), SatFat(1g), TransFat(0g), Cholesterol(0.014g), Sodium(0.314g), TCarbs(15g), DietFbr(0g),  Tsugar(12g), Protein(4g), VitA(0%),  VitC(0%),Calcium(0%), Iron(0%)","Diabetes, Hypertension"
FrozenGoods,TenderJuicyHotdogClassic 500-g,99,"Beef And Pork And Magnolia Chicken And Mechanically Separated Poultry. Soy Protein, Soy Protein, Sugar, Modified Starch, Iodized Salt, Milk Powder, Flavors, Sodium Phosphates (Acidity Regulator), Spices, Carrageenan (Stabilizer), Sodium Erythorbate (Reducing Agent), Sodium Nitrite ( Color Retention Agent), And Artificial Food Color From Casing (Allura Red), Contains: Soy, Mlik, Mustard, Wheat (Gluten), And Sulphites","Calories(67), TotalFat(5g), SatFat(2g), TransFat(0g), Cholesterol(0.019g), Sodium(0.221g), TCarbs(2g), DietFbr(0g),  Tsugar(1g), Protein(4g), VitA(0%),  VitC(0%),Calcium(0%), Iron(0%)","Diabetes, Hypertension"
FrozenGoods,TnderJuicyHotdogJumbo 1-kg,200,"Beef And Magnolia Chicken and Mechanically Separated Poultry, Water, Soy Protein, Sugar, Modified Starch, Lodized Salt, Milk Powder, Flavors, Sodium Phosphates (Acidity Regulator), Spices, Iodized Salt, Mlik Powder, Flavors, Erythorbate (Reducing Agent), Sodium Nitrite(color Retention Agent), And Artificial Food Color From Casing (Allura Red) , Contains: Soy, Mlik, Mustard, Wheat (Gluten), And Sulphites","Calories(67), TotalFat(5g), SatFat(2g), TransFat(0g), Cholesterol(0.018g), Sodium(0.183g), TCarbs(2g), DietFbr(1g),  Tsugar(1g), Protein(4g), VitA(0%),  VitC(0%),Calcium(0%), Iron(0%)","Diabetes, Hypertension"
FrozenGoods,CDOBarnChickenNuggets 200-g,210,"Chicken, Water, Starch, Sugar, Iodezed Salt, Wheat Flour, Soy Protein, Ground Pepper, Garlic Powder, Ginger Powder, Flavor Enhancers ( Containing Monosodium Glutamate, Ribonucleotide, Disodium Inosinate, Disodium Guanylate, Thiamine Hydrochloride), Chicken Fat, Onion, Nature-Identical Flavor, Egg Yolk, Hydrolyzed Soy Protein, Palm Oil, HUmectants( Monosodium Phosphate And Sodium Hexametaphosphate)","Calories(150),TotalFat(8g), SatFat(6g), TransFat(0g), Cholesterol(0.02g), Sodium(0.35g), TCarbs(13g), DietFbr(3g),  Tsugar(0g), Protein(7g), VitA(0%),  VitC(0%),Calcium(2%), Iron(8%)","Kidney Diseases, Hypertension"
FrozenGoods,PureFoodsCrazyCutNuggetsFunStuff 200-g,220,"Chicken Meat, Water, Soy Protein, Sugar, Milk Powder, Modifird Starch, Flavors, Iodized Salt, Spices, Fiber, Monosodium Glutamate (Flavor Enhancer), Sodium Diacetate (Acidity Regulator), Wheat Gluten, Carrageenan (Stabilizer), And Sodiaum Phosphate (Acidity Rrgulator), BATTERED AND BREADED WITH: Water, Wheat Flour, Starch, Modified Starch, Soybean Oil, Iodized Salt, Yeast, Monosodium Glutamate ( Flavor Enhancer), Sugar, Soy, FLour, Sodium Aluminum Phosphate (Leavening Agent), Paprika (Food Color), And Artificial Food Colors (Tartrazine, Sunset Yellow, Titanium Dioxide). Prepared in palm Olein, BBQ SAUCE INGREDIENTS: Water, Sugar, Modified Starch, Vinegar, Tomato Paste, Worcestershire Sauce, Dextroxe, Iodized Salt, Monosodium Glutamate And Inosinate Guanylate (Flavor Enhancer), Soy Sauce Powder, Guar Gum (Thickener) Caramel (Artifical Food Color), Acesulfame Potassium (Artificial Sweetener), Potassium Sorbate And Sodium Benzoate (Preservatives), Spices And Nature-Identical Flavors","Calories(112), TotalFat(5g), SatFat(2g), TransFat(0g), Cholesterol(0.009g), Sodium(0.194g), TCarbs(11g), DietFbr(2g),  Tsugar(1g), Protein(5g), VitA(0%),  VitC(0%),Calcium(0%), Iron(0%)","Kidney Diseases, Hypertension"
FrozenGoods,MagnoliaDariCremeClassic 100-g,75,"Coconut oil, Palm Oil, Palm Kernel Oil, Fully Hydrogenated Palm Stearin), Water, Mlik powder ( ButterMilk And/Or Skim Milk), Iodized Salt, Soya Lecithin And Monoglycerides As Emulsifiers, Natural And Artifical Flavors, Sodium Benzoate and Potassium Sorbate as Preservatives, Vatimins(E, A and D3), BHA and Propyl Gallate As Antioxidants, Beta-Carotene As Colorant, Contains: Contains Mlik And Soy","Calories(120), TotalFat(12g), SatFat(9g), TransFat(0g), Cholesterol(0g), Sodium(0.105g), TCarbs(2g), DietFbr(0g),  Tsugar(0g), Protein(0g), VitA(33%), VitD3(20%), VitE(25%),  VitC(0%), Calcium(0%), Iron(0%) ","Diabetes, Hypertension"
FrozenGoods,PureFoodsRecadoLongganisa 250-g,180,"Chicken Meat And Pork, Water, Sugar, Flavors, Soy Protein, Garlic, Iodized Salt, Spices, MonoSodium Glutamate (Flavor Enhancer), Sodium Phosphate (Acidity Regulator), Sodium Erythorbate ( Reducing Agent), Sodium Nitrite ( Color Retention Agent), and Allura Red ( Artificial Food Color) Packed in collagen casing, Contains: Soy, Wheat (GLuten), And Sulphites","Calories(107), TotalFat(8g), SatFat(3g), TransFat(0g), Cholesterol(0.013g), Sodium(0.275g), TCarbs(5g), DietFbr(1g),  Tsugar(4g), Protein(3g), VitA(0%), VitE(0%),  VitC(0%), Calcium(0%), Iron(0%)","Kidney Diseases, Hypertension"
FrozenGoods,PureFoodsBeefTapa 220-g,160,"Beef, Water, Sugar, Iodezed Salt, Monosodium Glutamate (Flavor Enhancer), Soy Sauce (Water, Soybean Extract, Flour, Iodized Salt, Caramel [Food Color], And Sodium Benzoate [(Preservative]), Modified Starch, Spices, Fiber, Garlic, Vinegar, Sodium Phosphate ( Acidity Regulator), Caramel (Food Color), And Sodium Erythorbate (Reducing Agent), Contains: Soy, Wheat (Gluten), And Sulphites","Calories(69), TotalFat(2g), SatFat(1g), TransFat(0g), Cholesterol(0.015g), Sodium(0.328g), TCarbs(7g), DietFbr(1g),  Tsugar(6g), Protein(5g), VitA(0%), VitE(0%),  VitC(0%), Calcium(0%), Iron(0%)","Kidney Diseases, Hypertension"
FrozenGoods,PureFoodsSweetHam 250-g,60,"Pork, Water, Money, Iodezed Salt, Modified Starch, Sugar, Vegetable Gum, Sodium Phosphate (Acidity Regulator), Flavors, Monosodium Glutamate (Flavor Enhancer), Sodium Erythorbate (Reducing Agent), Sodium Nitrite (Color Retention Agent), And Natural Food Color, Contains: Soy And Sulphites","Calories(34), TotalFat(0g), SatFat(0g), TransFat(0g), Cholesterol(0.013g), Sodium(0.422g), TCarbs(3g), DietFbr(0g),  Tsugar(1g), Protein(5g), VitA(0%), VitE(0%),  VitC(0%), Calcium(0%), Iron(0%)","Kidney Diseases, Hypertension"
FrozenGoods,CDOCrispyBURGER ,85,"Beef, Water, Soy Protein, Starch (Native $ modified), Sugar, Spicies and Seasoning, Breadcrumbs, Iodized Salt, Emulsifiers ( Containing  Sodium Tripolyphosphate, Tetrasodium Pyrophosphate, Sodium Hexametaphosphate Sodium Acid Pyrophosphate), And Sodium Benzoate (Preservative)  Coated with: Wheat Flour, Water, Starch, Vegetable, Shortening ( Non Hydrogenated palm), Iodized Salt, Sugar, Diacetyl Tartaric Acid Ester Of Mono- And Diglycerides ( Emulsifier),  Yeast ( Leacening), Sodium Acid Pyrophosphate (Leavening), Soium Bicarbonate (Leavening) FD&C Yellow No6 (Artificial Coloring), And FD&C Yellow No 5 (Arificial Coloring), Contains: Soya And Wheat, Egg, And milk","Calories(163), TotalFat(8g), SatFat(11g), TransFat(0g), Cholesterol(0.009g), Sodium(0.328g), TCarbs(16g), DietFbr(2g),  Tsugar(2g), Protein(6g), Phosphorus (7.5g) (VitA(0%), VitE(0%),  VitC(0%), Calcium(0%), Iron(0%)","Kidney Diseases, Hypertension"
FrozenGoods,PureFoodsLetter&NumbersNuggets,140,"Chicken Meat, Water, Soy Protein, Sugar, Milk Powder, Modifird Starch, Flavors, Iodized Salt, Spices, Fiber, Monosodium Glutamate (Flavor Enhancer), Sodium Diacetate (Acidity Regulator), Wheat Gluten, Carrageenan (Stabilizer), And Sodiaum Phosphate (Acidity Regulator).  BATTERED AND BREADED WITH Water, Flour, Startch, Modified Starch, SoyBean Oil, Iodized Salt, Yeast, Monosodium Glutamate (Flavor Enhancer), Sugar, Soy Flour, Sodium Aluminum Phosphate (Leavening Agent), Paprika(Food Color), And Artificial Food Colors (Tartrazine, Sunset Yellow, Titaniu, Dioxide), Prepared In Palm Olein BBQ SauceIngredients Water, Sugar, Modified Starch, Vinegar, Tomato Paste, Worcestershire Sauce, Dextrose, Iodozed Salt, Monosodium Glutamate And Inosinate Guanylate (Flavor Enhancer), Soy Sauce, Powder, Guar Gum (Thickener), Caramel (Artificial Food Color Acesulfame (Artificial Sweetener), Potassium Sorbate And Sodium Benzoate (Preservatives), Spices, And Nature-Identical Flavors.","Calories(112), TotalFat(5g), SatFat(2g), TransFat(0g), Cholesterol(0.009g), Sodium(0.0194g), TCarbs(11g), DietFbr(2g),  Tsugar(1g), Protein(5g), Phosphorus (7.5g) (VitA(0%), VitE(0%),  VitC(0%), Calcium(0%), Iron(0%)","Kidney Diseases, Hypertension"
Pastry,NihonichiBeekariiWhiteBread 60-g,60,"Enriched Wheat Flour, Water, Cane Sugar, Skimmed Milk Powder, Pure Vegetable Shortening, Iodized Salt, Baker's Yeast, Bread Improvers and Calcium Propionate","Calories(173), TotalFat(4g), SatFat(2g), TransFat(0g), Cholesterol(0g), Sodium(0.23g), TCarbs(0g), DietFbr(1g),  Tsugar(8g), Protein(7g), VitA(0%), VitC(0%),  Calcium(0%), Iron(0%)","Diabetes, Hypertension"
Pastry,CrossiniChocolateHazelnutWholePack 41-g,99,"Bread: [Wheat Flour, Vegetable Oil, Diglycerides (E471), as Emulsifying Agent, Yeast, Skimmed Milk Powder, Iodized Salt, Calcium Propionate(E282), as Preservative] Chocolate Cream Filling: [Sugar, Vegetable Fat, Chocolate Powder, Skimmed Milk Powder, Peanut Powder, Soya Lecithin (E322i), & Mono & Diglycerides (E4710, and Polyglycerol esters of Fatty Artificial (E475) as Emulsifying Agents, Artificial Hazelnut Flavor, Potassium Sorbate (E202) Preservative]","Calories(210), TotalFat(13g), SatFat(7g), TransFat(0g), Cholesterol(0.005g), Sodium(0.08g), TCarbs(19g), DietFbr(1g),  Tsugar(8g), Protein(3g), VitA(0%), VitC(0%),  Calcium(28.15%), Iron(21.10%)","Diabetes, Hypertension"
Pastry,CrossiniBavarianWholePack 41-g,99,"Bread: [Wheat Flour, Vegetable Fat, Water, Sugar, Eggs, Glucose Syrup, Mono & Diglycerides (E471), as Emulsifying Agent, Yeast, Skimmed Milk Powder, Iodized Salt, Calcium Propionate(E282), as Preservative]  Bavarian Cream Filling: [Vegetable Fat, Sugar, Whey Powder, Dextrose Powder, Skimmed Milk Powder, Soya Lecithin (E322i), Polyglycerol Polyricinoleate (E476) and Emulsifyinng Agents, Vanillin (Artificial Flavor Potassium Sorbate (E202) as Preservative Bavarian and Vanilla as Artificial Flavors, Beta Carotene (E160a) as Natural Color]","Calories(210), TotalFat(13g), SatFat(7g), TransFat(0g), Cholesterol(0.005g), Sodium(0.08g), TCarbs(20g), DietFbr(1g),  Tsugar(8g), Protein(3g), VitA(0%), VitC(0%),  Calcium(26.50%), Iron(1.65%)","Diabetes, Hypertension"
Pastry,ICHI-BunSoftCreamyFullmanLoaf ,75,"Flour, Sugar, Salt Yeast, Bread Improver, and Shortening","Calories(145), TotalFat(0g), SatFat(0g), TransFat(0g), Cholesterol(0g), Sodium(0g), TCarbs(29.0g), DietFbr(1.4g),  Tsugar(0g), VegTbleFat(0.3g),  Protein(2g), VitB1(0.0002g), VitB2(0.0002g),  VitB3(0.0026g), Calcium(0.068g), Iron(0.0014g)","Diabetes, Hypertension"
Pastry,DooweeDonut 440-g,99,"Cake: [Wheat Flour, Sugar, Eggs, Vegetable Oil, Water, Glucose Syrup, Sorbitol (E420ii) as Humectant, Cocoa Powder, Skimmed Milk Powder, Glycerine (E422), as Humectant, Mono & Diglycerides (E471) as Emulsifying Agent, Sodium Acid Pyrophosphate (E450i) & Sodium Bicarbonate (E500ii), as Leavening Agents, Iodized Salt, Potassium Sorbate (E202) as Preservative, Chocolate & Vanilla (Artificial Flavors), Xanthan Gum (E425), as Stabilizer] Chocolate Coating: [Sugar Hydrogenated Vegetable Fat, Cocoa Powder, Skimmed Milk Powder, Whey Powder, Soya Lecithin (E322i), & Polyglycerol Polyncinoleate (E476) as Emulsifying Agents, Vanillin (Artificial Flavor, Sorbic Acid (E200) as Preservative] Bavarian Filling: [Glucose Syrup, Water, Skimmed Milk Powder, Dorbitol (E420ii), as Humectant, Vgetable Oil, Modified Starch Pectin (E440) as Thickener, Titanium Dioxide (E171) as Artificial Color, Soya Lecithin (E3220) as Acidulant, FD&C Yellow #5 (Tartrazine) (E102) as Artificial Color]","Calories(190), TotalFat(9g), SatFat(6g), TransFat(0g), Cholesterol(0.02g), Sodium(0.11g), TCarbs(20g), DietFbr(0g),  Tsugar(16g), Protein(2g), VitA(0%), VitC(0%),  Calcium(31.92%), Iron(1.54%)","Diabetes, Hypertension"
