Categories,ProductName,Price,Ingredients,NutritionalFacts,Illness
Nibbles,GrowersOriental 80-g,42,"Peanuts, Wheat flour, Iodized salt (Salt and potassium iodate), Hydrolyzed soy protein, Spices, Coconut oil, Monosodium glutamate (Flavor enhancer), Silica (Anti-caking agent), Nature-identical flavor (Contains milk and egg), and Sugar.","Calories(190), TotalFat(14g), SatFat(6g), TransFat(0g), Cholesterol(0g), Sodium(0.05g), TCarbs(7g), DietFbr(0g), Tsugar(3g), Protein(7g), VitA(0%),VitC(0%), VitD(20%), Calcium(2%), Iron(5%), Potassium(0.135g), Phosphorus(24%), Magnesium(31%), Copper(0.00013g)","Hypertension, Gastrointestinal"
Nibbles,GrowersGarlic 80-g,40,"Peanuts, Garlic, Iodied salt (Salt and potassium iodate), Coconut oil, Monosodium glutamate (Flavor enhancer) and sugar","Calories(190), TotalFat(15g), SatFat(5g), TransFat(0g), Cholesterol(0g), Sodium(0.15g), TCarbs(7g), DietFbr(5g), Tsugar(2g), Protein(7g), VitA(0%),VitC(0%), VitD(20%), Calcium(0%), Iron(4%), Potassium(0.141g), Phosphorus(14%), Magnesium(12%), Copper(0.00013g)","Hypertension, Gastrointestinal"
Nibbles,GrowersHoneyRoasted 80-g,48,"Peanuts, Cane sugar, Wheat flour, Wheat starch, Iodized salt (Salt and potassium iodate), Coconut oil, Artificial honey flavor, Natural honey flavor, Locust bean gum (thickener), and Silica (Anti-caking agent)","Calories(170), TotalFat(11g), SatFat(6g), TransFat(0g), Cholesterol(0g), Sodium(0.125g), TCarbs(13g), DietFbr(2g), Tsugar(6g), Protein(7g), VitA(0%),VitC(0%), VitD(20%), Calcium(1%), Iron(4%), Potassium(0.123g), Phosphorus(22%), Magnesium(15%), Copper(0.00014g)","Hypertension, Gastrointestinal"
Nibbles,GrowersSavoryHot 30-g,16,"Peanuts, Wheat flour, Iodized salt (Salt and potassium iodate), Hydrolyzed soy protein, Spices, Coconut oil, Monosodium glutamate (Flavor enhancer), Silica (Anti-caking agent), Artificial beef flavor and sugar","Calories(190), TotalFat(14g), SatFat(4g), TransFat(0g), Cholesterol(0g), Sodium(0.15g), TCarbs(7g), DietFbr(5g), Tsugar(2g), Protein(7g), VitA(0%),VitC(0%), VitD(20%), Calcium(0%), Iron(8%), Potassium(0.138g), Phosphorus(4%), Magnesium(18%), Copper(0.00022g)","Hypertension, Gastrointestinal"
Nibbles,Growers Garlic 280-g,110,"Peanuts, Garlic, Iodied salt (Salt and potassium iodate), Coconut oil, Monosodium glutamate (Flavor enhancer) and sugar","Calories(190), TotalFat(15g), SatFat(5g), TransFat(0g), Cholesterol(0g), Sodium(0.15g), TCarbs(7g), DietFbr(5g), Tsugar(2g), Protein(7g), VitA(0%),VitC(0%), VitD(20%), Calcium(0%), Iron(4%), Potassium(0.141g), Phosphorus(14%), Magnesium(12%), Copper(0.00013g)","Hypertension, Gastrointestinal"
Nibbles,Hi-HoCrunchyNutsSweetChili 70-g,15,"Peanuts, Wheat flour, Modified food starch, Sugar, Palm olein, Iodized salt (Salt and potassium iodide), Hydrolyzed soy protein, Red pepper, Garlic powder, Monosodium glutamate (flavor enhancer), E621), and tertiary-butylhydroquinone (antioxidant)","Calories(150), TotalFat(6g), SatFat(5g), TransFat(0g), Cholesterol(0g), Sodium(0.04g), TCarbs(19g), DietFbr(2g), Tsugar(5g), Protein(4g), VitA(0%),VitC(0%), Calcium(2%), Iron(8%)","Kidney Diseases, Hypertension"
Nibbles,Hi-HoCrunchyNutsBBQ 70-g,16,"Peanuts, Wheat flour, Modified food starch, Sugar, Palm olein, Iodized salt (Salt and potassium iodide), Hydrolyzed soy protein, Artificial bbq flavor, Garlic powder, Onion powder, Monosodium glutamate (flavor enhancer), E621), and tertiary-butylhydroquinone (antioxidant)","Calories(160), TotalFat(8g), SatFat(3g), TransFat(0g), Cholesterol(0g), Sodium(0.125g), TCarbs(17g), DietFbr(1g), Tsugar(5g), Protein(4g), VitA(0%),VitC(0%), Calcium(2%), Iron(8%)","Kidney Diseases, Hypertension"
Nibbles,WLFCornBitsOrigSuperGarlic 100-g,15,"Corn, Coconut, Oil & Garlic Flavor (Sugar, Iodized Salt, MSG, Chili Powder, Black Pepper, Garlic Powder, Soy Sauce Powder & Hydrolyzed Vegetable Protein)","Calories(310), TotalFat(12g), SatFat(6g), TransFat(0g), Cholesterol(0g), Sodium(0.311g), TCarbs(45g), DietFbr(1g), Tsugar(5g), Protein(7g), VitA(10%),VitC(7%), Calcium(4%), Iron(10%)","Hypertension, Gastrointestinal"
Nibbles,WLFCornBitsChiliChiz 70-g,15,"Roasted Corn, Coconut Oil & Cheese Flavor Seasoning (Sugar, Iodized Salt, MSG, Milk Powder, Yeast Extracr, Art. Cheese Flavor, Chili Powder & FD&C Yellow #5 w/ Tartrazine & Sunset Yellow #5)","Calories(310), TotalFat(12g), SatFat(6g), TransFat(0g), Cholesterol(0g), Sodium(0.311g), TCarbs(45g), DietFbr(1g), Tsugar(5g), Protein(7g), VitA(10%),VitC(7%), Calcium(4%), Iron(10%)","Hypertension, Gastrointestinal"
Nibbles,WLFSigaRoastedSpicyBeef 100-g,15,"Corn, Coconut, Oil & Garlic Flavor (Sugar, Iodized Salt, MSG (E621), Chili Powder, Garlic Powder, & Beef Oil)","Calories(310), TotalFat(12g), SatFat(6g), TransFat(0g), Cholesterol(0g), Sodium(0.311g), TCarbs(45g), DietFbr(1g), Tsugar(5g), Protein(7g), VitA(10%),VitC(7%), Calcium(4%), Iron(10%)","Kidney Diseases, Hypertension"
Nibbles,WLFSigaRoastedOriginal 100-g,15,"Corn, Coconut, Oil & Garlic Flavor (Sugar, Iodized Salt, MSG (E621), Chili Powder, Black Pepper, Garlic Powder, Soy Sauce Powder)","Calories(310), TotalFat(12g), SatFat(6g), TransFat(0g), Cholesterol(0g), Sodium(0.311g), TCarbs(45g), DietFbr(1g), Tsugar(5g), Protein(7g), VitA(10%),VitC(7%), Calcium(4%), Iron(10%)","Kidney Diseases, Hypertension"
Nibbles,WLFSigaRoastedMixSavoryFlavor 100-g,15,"Corn, Peanut, Green Peas, Wheat Flour, Modified Starch, Vegatable Oil (May contain one or more of the ff: Coconut Oil, Palm Oil, and/or Palm Olein), Sugar, Iodized Salt, MSG (E621), Onion Powder, Chili Powder, Black Pepper, Garlic Powder, Soy Sauce Powder, Food Color (Tartazine (E102) & Brilliant Blue (E133)","Calories(310), TotalFat(12g), SatFat(6g), TransFat(0g), Cholesterol(0g), Sodium(0.311g), TCarbs(45g), DietFbr(1g), Tsugar(5g), Protein(7g), VitA(10%),VitC(7%), Calcium(4%), Iron(10%)","Kidney Diseases, Hypertension"
Nibbles,DingDongMixedNutsGarlic 100-g,22,"Corn, Green Peas, Fava Beans, Peanuts, Wheat Flour, Vegetable Oil (Palm, Corn & Coconut), Sugar, Hydrolyzed Soy Protein, Iodized Salt (Salt, Potassium Iodide), Fried Garlic, Garlic Powder, Artificial Color (FD & C Yellow #5 (E102), FD & C Blue #1 (E133), Monosodium Glutamtate (Flavor Enhancer, E621) and Tertiary-Butylhydroquinone (Antioxidant)","Calories(160), TotalFat(10g), SatFat(4g), TransFat(0g), Cholesterol(0g), Sodium(0.15g), TCarbs(14g), DietFbr(5g), Tsugar(3g), Protein(5g), VitA(0%),VitC(0%), Calcium(2%), Iron(8%)","Kidney Diseases, Hypertension"
Nibbles,WLFCornBitsBBQ 70-g,18,"Corn, Coconut Oil & BBQ Flavor Seasoning (Sugar, Iodized Salt, MSG, Chili Powder, Black Pepper, Garlic Powder, Soy Sauce Powder & Hydrolyzed Vegetable Protein)","Calories(310), TotalFat(12g), SatFat(6g), TransFat(0g), Cholesterol(0g), Sodium(0.311g), TCarbs(45g), DietFbr(1g), Tsugar(5g), Protein(7g), VitA(10%),VitC(7%), Calcium(4%), Iron(10%)","Hypertension, Gastrointestinal"
Nibbles,WLFCornBitsSpicyHotApoy 70-g,22,"Corn, Vegetable Oil, Iodized Salt, Sugar, MSG., Tomato Powder & Chili Powder","Calories(310), TotalFat(12g), SatFat(6g), TransFat(0g), Cholesterol(0g), Sodium(0.311g), TCarbs(45g), DietFbr(1g), Tsugar(5g), Protein(7g), VitA(10%),VitC(7%), Calcium(4%), Iron(10%)","Hypertension, Gastrointestinal"
Nibbles,WLFMuncherBeefSpicy 100-g,22,"Green Peas, Modified Starch, Wheat Flour, Sugar, Iodized Salt, MSG (E621),  Spices (Chili Powder, Garlic Powder, & Black Pepper), Beef Flavor & Food Color (FD&C Yellow #5 w/ Tartrazine & Brilliant Blue #1)","Calories(330), TotalFat(13g), SatFat(12g), TransFat(0g), Cholesterol(0g), Sodium(0.329g), TCarbs(40g), DietFbr(12g), Tsugar(5g), Protein(14g), VitA(5%),VitC(24%), Calcium(4%), Iron(17%)","Kidney Diseases, Hypertension"
Nibbles,WLFMuncherBeefSpicy 70-g,22,"Roasted Green Peas, Modified Starch, Wheat Flour, Sugar, Iodized Salt, MSG (E621),  Spices (Chili Powder, Garlic Powder, & Black Pepper), Beef Flavor & Food Color (FD&C Yellow #5 w/ Tartrazine & Brilliant Blue #1)","Calories(330), TotalFat(13g), SatFat(12g), TransFat(0g), Cholesterol(0g), Sodium(0.329g), TCarbs(40g), DietFbr(12g), Tsugar(5g), Protein(14g), VitA(5%),VitC(24%), Calcium(4%), Iron(17%)","Kidney Diseases, Hypertension"
Nibbles,DingDongSnackMix 95-g,22,"Corn, Green Peas, Peanuts, Wheat Flour, Vegetable Oil (Palm, Corn & Coconut), Sugar, Hydrolyzed Soy Protein, Iodized Salt (Salt, Potassium Iodide), Garlic Powder, Onion Powder, Red Pepper, Artificial Color (FD & C Yellow #5 (E102), FD & C Blue #1 (E133), Monosodium Glutamtate (Flavor Enhancer, E621) and Tertiary-Butylhydroquinone (Antioxidant)","Calories(160), TotalFat(9g), SatFat(6g), TransFat(0g), Cholesterol(0g), Sodium(0.15g), TCarbs(17g), DietFbr(3g), Tsugar(1g), Protein(3g), VitA(0%),VitC(0%), Calcium(4%), Iron(8%)","Kidney Diseases, Hypertension"
Nibbles,BoyBawangCornickHotGarlic 90-g,22,"Fried Corn, Vegetable Oil (May Contain Coconut Oil and for Palm Olein), Garlic Chips, Garlic Powder, Monosodium Glutamate (as Flavor Enhancer), Sugar, Iodized Salt, Chili Powder, Disodium 5' -ribonucleotide (as flavor enhancer) (E635) and Natural Chili Flavor.","Calories(120), TotalFat(5g), SatFat(3g), TransFat(0g), Cholesterol(0g), Sodium(0.22g), TCarbs(17g), DietFbr(1g), Tsugar(0g), Protein(2g), VitA(0%),VitC(0%), Calcium(7%), Iron(8%), Potassium(110mg)","Hypertension, Gastrointestinal"
Nibbles,BoyBawangCornickAdobo 90-g,22,"Fried Corn, Vegetable Oil (May Contain Coconut Oil And/Or Palm Olein), Sugar, Monosodium Glutamate (As Flavour Enhancer), Onion Powder, Artificial Flavour (Beef), Iodized Salt, Soy Sauce Powder. Allergen Information: Contains Soy.","Calories(120), TotalFat(6g), SatFat(4g), TransFat(0g), Cholesterol(0g), Sodium(0.22g), TCarbs(17g), DietFbr(2g), Tsugar(0g), Protein(3g), VitA(0%),VitC(0%), Calcium(0%), Iron(0%), Potassium(49mg)","Hypertension, Gastrointestinal"
Nibbles,DingDongMixedNuts 100-g,22,"Corn, Green Peas, Peanuts, Fava Beans, Wheat Flour, Modified Food Starch, Vegetable Oil (Palm, Corn & Coconut), Sugar, Hydrolyzed Soy Protein, Iodized Salt (Salt, Potassium Iodide), Garlic Powder, Onion Powder, Red Pepper, Artificial Color (FD & C Yellow #5 (E102), FD & C Blue #1 (E133), Monosodium Glutamtate (Flavor Enhancer, E621) and Tertiary-Butylhydroquinone (Antioxidant)","Calories(150), TotalFat(8g), SatFat(4g), TransFat(0g), Cholesterol(0g), Sodium(0.15g), TCarbs(16g), DietFbr(5g), Tsugar(3g), Protein(4g), VitA(0%),VitC(0%), Calcium(3%), Iron(8%)","Kidney Diseases, Hypertension"
Nibbles,DingDongMixedNutsH&S 100-g,22,"Corn, Green Peas, Peanuts, Fava Beans, Wheat Flour, Modified Food Starch, Vegetable Oil (Palm, Corn & Coconut), Sugar, Hydrolyzed Soy Protein, Iodized Salt (Salt, Potassium Iodide), Garlic Powder, Onion Powder, Chili Powder, Artificial Color (FD & C Yellow #5 (E102), FD & C Blue #1 (E133), Monosodium Glutamtate (Flavor Enhancer, E621) and Tertiary-Butylhydroquinone (Antioxidant)","Calories(150), TotalFat(7g), SatFat(3g), TransFat(0g), Cholesterol(0g), Sodium(0.225g), TCarbs(16g), DietFbr(5g), Tsugar(3g), Protein(5g), VitA(0%),VitC(0%), Calcium(2%), Iron(2%)","Kidney Diseases, Hypertension"
Nibbles,BoyBawangCornickBBQ 90-g,22,"Fried Corn, Vegetable Oil (May Contain Coconut Oil and for Palm Olein), Onion Powder, Garlic Powder, Monosodium Glutamate (as Flavor Enhancer) (E621), Sugar, Iodized Salt, Yeast Extract, Chili Powder, Soy Sauce Powder, Disodium 5' -ribonucleotide (as flavor enhancer) (E635) and Natural Chili Flavor.","Calories(120), TotalFat(5g), SatFat(4g), TransFat(0g), Cholesterol(0g), Sodium(0.12g), TCarbs(17g), DietFbr(1g), Tsugar(3g), Protein(3g), VitA(0%),VitC(0%), Calcium(2%), Iron(0%), Potassium(0.056g)","Hypertension, Gastrointestinal"
Nibbles,HappyPeanutsOrig 100-g,33,"Peanuts, Palm Olein, Fried Garlic, Garlic Powder, Iodized Salt (Salt, Potassium Iodide) Monosodium Glutamate (Flavor Enhancer, E621) and Tertiary-Butylhydroquinone (Antioxidant)","Calories(190), TotalFat(14g), SatFat(6g), TransFat(0g), Cholesterol(0g), Sodium(0.095g), TCarbs(6g), DietFbr(4g), Tsugar(1g), Protein(9g), VitA(0%),VitC(0%), Calcium(2%), Iron(8%)","Kidney Diseases, Hypertension"
Nibbles,HappyPeanutsSweetChili 100-g,25,"Peanuts,Coconut Oil & Palm Oil, Iodized Salt (Salt, Potassium Iodide) Hydrolyzed Soy Protein, Garlic Powder, Monosodium Glutamate (Flavor Enhancer, E621) Sucralose (Sweetener) and Tertiary-Butylhydroquinone (Antioxidant)","Calories(180), TotalFat(13g), SatFat(3g), TransFat(0g), Cholesterol(0g), Sodium(0.19g), TCarbs(7g), DietFbr(4g), Tsugar(2g), Protein(8g), VitA(0%),VitC(0%), Calcium(2%), Iron(8%)","Kidney Diseases, Hypertension"
Nibbles,HappyPeanutsBBQ 100-G,25,"Peanuts,Coconut Oil & Palm Oil, Iodized Salt (Salt, Potassium Iodide) Hydrolyzed Soy Protein, Spices (Garlic & Onion Powder), Monosodium Glutamate (Flavor Enhancer, E621) and Tertiary-Butylhydroquinone (Antioxidant)","Calories(190), TotalFat(15g), SatFat(3.5g), TransFat(0g), Cholesterol(0g), Sodium(0.22g), TCarbs(4g), DietFbr(3g), Tsugar(1g), Protein(10g), VitA(0%),VitC(0%), Calcium(2%), Iron(8%)","Kidney Diseases, Hypertension"
Nibbles,HappyPeanutsClassicAdobongMani 100-G,25,"Peanuts, Palm Olein, Fried Garlic, Iodized Salt (Salt, Potassium Iodide) Monosodium Glutamate (Flavor Enhancer, E621) and Tertiary-Butylhydroquinone (Antioxidant)","Calories(180), TotalFat(13g), SatFat(9g), TransFat(0g), Cholesterol(0g), Sodium(0.21g), TCarbs(6g), DietFbr(3g), Tsugar(2g), Protein(9g), VitA(0%),VitC(0%), Calcium(7%), Iron(13%)","Kidney Diseases, Hypertension"
Nibbles,DingDongSnackMixSweet&Spicy 95-g,22,"Corn, Green Peas, Peanuts, Wheat Flour, Vegetable Oil (Palm, Corn & Coconut), Sugar, Hydrolyzed Soy Protein, Iodized Salt (Salt, Potassium Iodide), Garlic Powder, Red Pepper, Artificial Color (FD & C Yellow #5 (E102), FD & C Blue #1 (E133), Monosodium Glutamtate (Flavor Enhancer, E621) and Tertiary-Butylhydroquinone (Antioxidant)","Calories(150), TotalFat(7g), SatFat(5g), TransFat(0g), Cholesterol(0g), Sodium(0.2g), TCarbs(19g), DietFbr(3g), Tsugar(1g), Protein(3g), VitA(0%),VitC(0%), Calcium(2%), Iron(8%)","Kidney Diseases, Hypertension"
Nibbles,BoyBawangCornickChiliCheese 90-g,22,"Fried Corn, Vegetable Oil (May Contain Coconut Oil and for Palm Olein), Cheese Powder (May Contain FD&C 5 and FD&C 8), Monosodium Glutamate (as Flavor Enhancer), Sugar, Iodized Salt and Chili Powder.","Calories(144), TotalFat(6g), SatFat(4g), TransFat(0g), Cholesterol(0g), Sodium(0.24g), TCarbs(19g), DietFbr(0g), Tsugar(0g), Protein(4g), VitA(0%),VitC(0%), Calcium(2%), Iron(8%), Potassium(0.082g)","Hypertension, Gastrointestinal"
Nibbles,BoyBawangChicharonGarlic 90-g,22,"Fried Corn, Vegetable Oil (May Contain Coconut Oil and for Palm Olein), Garlic Chips, Iodized Salt, Monosodium Glutamate (as flavor enhancer) (E621), Garlic Powder, Sugar, Chili Powder and Disodium 5', Ribonucleotide (as flavor enhancer) (E635)","Calories(142), TotalFat(6g), SatFat(3g), TransFat(0g), Cholesterol(0g), Sodium(0.202g), TCarbs(20g), DietFbr(2g), Tsugar(2g), Protein(2g), VitA(0%),VitC(0%), Calcium(3%), Iron(8%), Potassium(0.075g)","Hypertension, Gastrointestinal"
Nibbles,WLFCornBitsMix 100-g,15,"Corn, Peas, Peanuts, Wheat Flour, Coconut Oil, BBQ Flavor, Sugar, Hydrolyzed Vegetable Protein, Iodized Salt, Garlic Powder Soy Sauce Powder, Artificial Color (FD&C Yellow #5 (E102), FD&C Blue #1 (E133), Monosodium Glutamtate (Flavor Enhancer, E621) and Tertiary-Butylhydroquinone (Antioxidant)","Calories(330), TotalFat(13g), SatFat(8g), TransFat(0g), Cholesterol(0g), Sodium(0.4g), TCarbs(43g), DietFbr(9g), Tsugar(5g), Protein(11g), VitA(20%),VitC(15%), Calcium(6%), Iron(15%)","Hypertension, Gastrointestinal"
Nibbles,WLFMuncherGreenPeasOrig 100-g,15,"Green Peas, Vegetable Oil, Sugar, Iodized Salt, MSG (E621), Spices (Chili Powder & Black Pepper), HVP-Beefy Flavor & Food Color (FD&C Yellow #5 w/ Tartrazine & Brilliant Blue #1)","Calories(330), TotalFat(13g), SatFat(12g), TransFat(0g), Cholesterol(0g), Sodium(0.329g), TCarbs(40g), DietFbr(12g), Tsugar(5g), Protein(14g), VitA(5%),VitC(24%), Calcium(4%), Iron(17%)","Kidney Diseases, Hypertension"
Nibbles,BoyBawangCornickGarlic 30-g,5.5,"Fried corn, vegetable oil (may contain coconut oil and/or palm olein), iodized salt, garlic, monosodium glutamate (as a flavor enhancer), garlic powder, sugar and chili powder.","Calories(150), TotalFat(7g), SatFat(5g), TransFat(0g), Cholesterol(0g), Sodium(0.230g), TCarbs(19g), DietFbr(1g), Tsugar(0.5g), Protein(3g), VitA(0%),VitC(0%), Calcium(8%), Iron(6%)","Hypertension, Kidney Diseases"
Coffee/Milk,NesCafeGOLD,250,100% soluble coffee,"Calories(7), TotalFat(0g), SatFat(0g), TransFat(0g), Cholesterol(0g), Sodium(0g), TCarbs(1.2g), DietFbr(0g), Tsugar(0g), Protein(0.4g), VitA(0%), VitC(0%), Calcium(0%), Iron(0%)","Hypertension, Diabetes"
Coffee/Milk,FrencheRoastTiramisu - Pack,300,"Non-Dairy Creamer [ Glucose Syrup, Hydrogenated Vegetable Oil, Sodium Caseinate (Milk Protein), Stabilizer (INS340ii), Emilsifier (INS471), Anticaking Agent (INS551)], Sugar, Maltodextrin Instant Coffee Powder (6%), Instant Freeze Dried Coffee (2%), Microground Coffee (0.5%), Skimmed Milk Powder, Cocoa, Salt, Flavour( Titamisu), Sucralose, Anticaking Agent (INS551)","Calories(0), TotalFat(2.4g), SatFat(2.3g), TransFat(0g), Cholesterol(0g), Sodium(0.041g), TCarbs(18.2g), DietFbr(0.4g), Tsugar(7.2g), Protein(1.0g), VitA(0%), VitC(0%), Calcium(0%), Iron(0%)","Hypertension, Diabetes"
Coffee/Milk,FrencheRoastSaltedCaramel - Pack,305,"Non-Dairy Creamer [ Glucose Syrup, Hydrogenated Vegetable Oil, Sodium Caseinate (Milk Protein), Stabilizer (INS340ii), Emilsifier (INS471), Anticaking Agent (INS551)], Sugar, Maltodextrin Instant Coffee Powder (7%), Instant Freeze Dried Coffee (3%), Microground Coffee (0.1%), Salt, Flavour (Salted Caramel), Sucralose, Anticaking Agent (INS551)","Calories(0), TotalFat(2.5g), SatFat(2.5g), TransFat(0g), Cholesterol(0g), Sodium(0.043g), TCarbs(18.1g), DietFbr(0.4g), Tsugar(7.2g), Protein(0.9g), VitA(0%), VitC(0%), Calcium(0%), Iron(0%)","Hypertension, Diabetes"
Coffee/Milk,NesCafeOriginal - Pack,250,"Sugar, Coffee Creamer [ Glucose Syrup, Hydrogenated Vegetable Oil, Sequestrants (Dipotassium Phostphate, Trisodium Citrate, Sodium Polyphosphate), CASEINATE, Emulsifiers (Mono- And Di-Glycerides Of Fatty Acids, DATEM), Anticaking Agent (Calcium Carbonate), Salt], Maltodextrin, NESCAFE Instant Coffee, Iodezed Salt, Stabilizer (CMC), Nature-Identical Flavor, Sweetener (AcesulfamePotassium), Contains: Milk","Calories(0), TotalFat(3.5g), SatFat(3.2g), TransFat(0.03g), Cholesterol(0g), Sodium(0.078g), TCarbs(21g), DietFbr(0.1g), Tsugar(12.5g), Protein(0.3g), VitA(0%), VitC(0%), Calcium(0%), Iron(0%)","Hypertension, Diabetes"
Coffee/Milk,NesCafeCreamyWhite - Pack,180,"Coffee Creamer [ Glucose Syrup, Hydrogenated Vegetable Oil, Sequestrants (Dipotassium Phosphate, Trisodium Citrate, Sodium Polyphosphate), CASEINATE, Emulsifiers (Mono- And Di Glycerides Of Fatty Acids, DATEM), Anticaking Agent (Calcium Carbonated), Salt], Sugar, NESCAFE Instant Coffee, Starch, Powdered Milk Drink (SOYA), Nature-identical Flavors, Maltodextrin, Iodized Salt, Sweetener (Acesulfame Potassium), Contains: MILK AND SOYA","Calories(0), TotalFat(4.6g), SatFat(3.8g), TransFat(0.04g), Cholesterol(0.04g), Sodium(0.0108g), TCarbs(19g), DietFbr(0.1g), Tsugar(12.4g), Protein(0.4g), VitA(0%), VitC(0%), Calcium(0%), Iron(0%)","Hypertension, Diabetes"
Coffee/Milk,CoffeeMateTheOriginal -150-g,160,"Glucose Syrup, Hydrogenated Vegetable Oil, Sequestrants ( Dispotassium Phosphate, Trisodium Citrate, Sodium Polyphosphate, Caseinate, Flavors, Emulsifiers (Mono- and di-glycerides of fatty acids, Datem), Anticaking Agent (Calcium Carbonate), Iodized Salt, Sweetener (Acesulfame Potassium), Contains: MILK","Calories(0), TotalFat(1.9g), SatFat(1.7g), TransFat(0.02g), Cholesterol(0g), Sodium(0.034g), TCarbs(2.5g), DietFbr(0.03g), Tsugar(0.5g), Protein(0.07g), VitA(0%), VitC(0%), Calcium(0%), Iron(0%)",Gatrointestinal
Coffee/Milk,NescafeOriginalTwinPack 26-g,159,"Sugar, Coffee Creamer [ Glucose Syrup, Hydrogenated Vegetable Oil, Sequestrants (Dipotassium Phostphate, Trisodium Citrate, Sodium Polyphosphate), CASEINATE, Emulsifiers (Mono- And Di-Glycerides Of Fatty Acids, DATEM), Anticaking Agent (Calcium Carbonate), Salt], Maltodextrin, NESCAFE Instant Coffee, Iodezed Salt, Stabilizer (CMC), Nature-Identical Flavor, Sweetener (AcesulfamePotassium), Contains: Milk","Calories(0), TotalFat(3.5g), SatFat(3.2g), TransFat(0.03g), Cholesterol(0g), Sodium(0.078g), TCarbs(21g), DietFbr(0.1g), Tsugar(12.5g), Protein(0.3g), VitA(0%), VitC(0%), Calcium(0%), Iron(0%)","Hypertension, Diabetes"
Coffee/Milk,NesCafeCreamyWhite 26-g,159,"Coffee Creamer [ Glucose Syrup, Hydrogenated Vegetable Oil, Sequestrants (Dipotassium Phosphate, Trisodium Citrate, Sodium Polyphosphate), CASEINATE, Emulsifiers (Mono- And Di Glycerides Of Fatty Acids, DATEM), Anticaking Agent (Calcium Carbonated), Salt], Sugar, NESCAFE Instant Coffee, Starch, Powdered Milk Drink (SOYA), Nature-identical Flavors, Maltodextrin, Iodized Salt, Sweetener (Acesulfame Potassium), Contains: MILK AND SOYA","Calories(0), TotalFat(4.6g), SatFat(3.8g), TransFat(0.04g), Cholesterol(0.04g), Sodium(0.0108g), TCarbs(19g), DietFbr(0.1g), Tsugar(12.4g), Protein(0.4g), VitA(0%), VitC(0%), Calcium(0%), Iron(0%)","Hypertension, Diabetes"
Coffee/Milk,NescafeClassic 92-g,120,100% pure coffee beans,"Calories(7), TotalFat(0g), SatFat(0g), TransFat(0g), Cholesterol(0g), Sodium(0.005g), TCarbs(1.2g), DietFbr(0g), Tsugar(0g), Protein(0.4g), VitA(0%), VitC(0%), Calcium(0%), Iron(0%)","Hypertension, Diabetes"
Coffee/Milk,NescafeClassicDECAFE 80-g,80,100% pure coffee beans,"Calories(1), TotalFat(0g), SatFat(0g), TransFat(0g), Cholesterol(0g), Sodium(0.005g), TCarbs(0g), DietFbr(0g), Tsugar(0g), Protein(0.3g), VitA(0%), VitC(0%), Calcium(0%), Iron(0%), Potassium (0.116g)","Hypertension, Diabetes"
Coffee/Milk,NescafeClassic 23-g,23,100% pure coffee beans,"Calories(7), TotalFat(0g), SatFat(0g), TransFat(0g), Cholesterol(0g), Sodium(0.005g), TCarbs(1.2g), DietFbr(0g), Tsugar(0g), Protein(0.4g), VitA(0%), VitC(0%), Calcium(0%), Iron(0%)","Hypertension, Diabetes"
Coffee/Milk,NescafeClassic 91.2-g,79,100% pure coffee beans,"Calories(7), TotalFat(0g), SatFat(0g), TransFat(0g), Cholesterol(0g), Sodium(0.005g), TCarbs(1.2g), DietFbr(0g), Tsugar(0g), Protein(0.4g), VitA(0%), VitC(0%), Calcium(0%), Iron(0%)","Hypertension, Diabetes"
Coffee/Milk,NestleCoffeeMate 25-g,120,"Glucose Syrup, Hydrogenated Vegetable Oil, Sequestrants (Dipotassium Phosphate, Trisodium Citrate, Sodium Polyphosphate), CASEINATE, Flavors, Emulsifiers (Mono- and Di- Glycerides Of Fatty Acids, DATEM), Anticaking Agent(Calcium Carbonate), Iodized Salt, Sweetener (Acesulfame Potassium), Contains: Milk","Calories(0), TotalFat(1.9g), SatFat(1.2g), TransFat(0.02g), Cholesterol(0.04g), Sodium(0.034g), TCarbs(2.5g), DietFbr(0.03g), Tsugar(0.5g), Protein(0.07g), VitA(0%), VitC(0%), Calcium(0%), Iron(0%)",Gastrointestinal
Coffee/Milk,NestleBearBrand 1120 -g,390,"Milk Products (Skimmed Milk, ButterMilk), Glucose Syrup, Vegetable Oil Sugar, Minerals (Calcium Iron, Zinc), Emulsifiers (Soya Lecithin, Mono- And Diglycerides Of Fatty Acids, Sodium Polyphosphate, Disodium Phosphate, Sodium Cirtrate), Caseinate Vitamins (C, E, B6, B1, Pantothenic Acid, A, B2, D, Biotin, B12), Natural Flavors (Milk), Contains: Milk,Soya","Calories(0), TotalFat(6.6g), SatFat(2.7g), TransFat(0g), Cholesterol(0.0026g), Sodium(0.09g), TCarbs(0.0185g), DietFbr(0g), Tsugar(10.9g), Protein(5g), Magnesium(0.0165%), Phosphorus(0.146%), Potassium(0.221%), Zinc(0.0024%) , VitA(33%), VitC(0.033%), Calcium(0%), Iron(0.0039%), VitE(44%),VitB1(74%), VitB2(43%), VitEB6(100%), VitB12(69%), Pantothenic Acid (0.0006%), Biotin (3.2e-6%)","Gastrointestinal, Liver Diseases"
Coffee/Milk,NestleBearBrand 300 -g,120,"Milk Products (Skimmed Milk, ButterMilk), Glucose Syrup, Vegetable Oil Sugar, Minerals (Calcium Iron, Zinc), Emulsifiers (Soya Lecithin, Mono- And Diglycerides Of Fatty Acids, Sodium Polyphosphate, Disodium Phosphate, Sodium Cirtrate), Caseinate Vitamins (C, E, B6, B1, Pantothenic Acid, A, B2, D, Biotin, B12), Natural Flavors (Milk), Contains: Milk,Soya","Calories(0), TotalFat(6.6g), SatFat(2.7g), TransFat(0g), Cholesterol(0.0026g), Sodium(0.09g), TCarbs(0.0185g), DietFbr(0g), Tsugar(10.9g), Protein(5g), Magnesium(0.0165%), Phosphorus(0.146%), Potassium(0.221%), Zinc(0.0024%) , VitA(33%), VitC(0.033%), Calcium(0%), Iron(0.0039%), VitE(44%),VitB1(74%), VitB2(43%), VitEB6(100%), VitB12(69%), Pantothenic Acid (0.0006%), Biotin (3.2e-6%)","Gastrointestinal, Liver Diseases"
Coffee/Milk,NestleNestogen1-3 340-g,120,"Skimmed Milk, Lactose Vegetable Oils(High Oleic Sunflower Oil, Coconut Oil, Low Erucic Acid Rapeseed Oil, Sunflower Oil), Minerals (Calcium Citrate, Sodium Phosphate, Potassium Citrate, Magnesium Citrate, Zinc Sulfate, Copper Sulfate, Potassium Chloride, Manganese Sulfate, Sodium Selenate), Soya Lecithin (Emulsifier), Flavors (Vanillin And Vanilla Extract), Vitamins (SOdium Ascorbate, DL-Alpha-Tocopheryl Acetate, Nicotinamide, Calcium D-Pantothenate, Thiamine Mononitrate, Retinyl Acetate, Pyridoxine Hydrochloride, Riboflavin, Folic Acid, Phytomenadione, Biotin, Cholocalciferol, Cyanocabalamin), Fish Oil(Docosahexaenoic Acid) And Lacctosbacillus Reuteri Culture (DMS 17938*), Contains: Milk (Including Lactose), Soya,Fish Oil","Calories(0), TotalFat(0g), SatFat(0g), TransFat(0g), Cholesterol(0g), Sodium(0.3g), TCarbs(58.8g), DietFbr(0g), Tsugar(10.9g), Lactose(54g), Sucrose(0g),Sodium (0.3g) Protein(14.6g), Magnesium(0.066%), Phosphorus(0.488%), Potassium(0.75g), Chloride (0.456g), Zinc(0.00425g) , VitA(33%), VitC(0.097g), Calcium(0.871g), Iron(0.0039g), VitE(44%),VitB1(74%), VitB2(43%), VitEB6(100%), VitB12(69%), Pantothenic Acid (0.0006%), Biotin (3.2e-6%)",Gastrointestinal
